[{"access":{"kind":"local","uri":null},"content_kind":"plain_text","ingest_version":"text-v1","language":"en","page_count":null,"rights_note":"Original synthetic text released with this repository; not a historical source.","sha256":"87abdce55610c805edcbb0f169c54de090c66ac7690652163b221d013a88eadd","source_id":"source:synthetic_meridian_note","source_type":"other","title":"Synthetic Meridian Institute note"}]
